run	val_loss	params_M	status	time_s	improv_%	description
001	3.5000	7.5	keep	600	0.0	baseline: pretrained DeiT-Tiny frozen, bs=4, lr=5e-4
002	3.6189	7.5	discard	600	-3.4	lr=1e-3 (too high)
003	3.1334	7.5	keep	1800	10.5	bs=2 + 30min (VQA=2.26!)
004	3.1081	7.5	keep	3600	11.2	bs=2 + 60min (OD=3.30, Seg=4.73)
005	2.8903	7.5	keep	3600	17.4	lr=3e-4 (VQA=2.09!)
006	2.9947	7.5	discard	3600	14.4	lr=1e-4 (too slow)
007	2.9829	9.1	discard	3600	14.8	lang_depth=8 (slower, fewer steps)
008	3.0476	13.0	discard	3600	12.9	unfrozen vision (slower, no benefit)
009	3.0546	7.5	discard	7200	12.7	2hr training (overfitting after 5 epochs)
010	2.7998	7.5	keep	3600	20.0	cosine lr + dropout=0.2 (anti-overfit)
011	2.8984	7.5	discard	3600	17.2	wd=0.01 (seg=4.57 best but overall worse)
012	2.9858	7.5	discard	3600	14.7	wd=0.05
013	3.7491	7.6	discard	3600	-7.1	label smoothing=0.1 + MLP proj (too aggressive)
014	2.8941	7.6	discard	3600	17.3	MLP projector (no benefit over linear)
015	2.7908	11.2	keep	3600	20.3	wider decoder dim=384 depth=4 (11.2M trainable)
016	2.8548	11.3	keep	7200	18.4	DeiT-Small (22M frozen) + 2hr
017	3.2353	11.3	discard	600	7.6	H100 bs=64 lr=1e-3 +20K data (seg=3.33!)
018	3.2348	11.3	discard	600	7.6	H100 bs=128 lr=3e-4 compiled
019	3.2859	11.3	discard	600	6.1	H100 bs=16 lr=3e-4 (too few steps)
020	3.1249	11.3	keep	1200	10.7	H100 bs=32 lr=5e-4 20min +20K data
021	3.1721	14.8	discard	1200	9.4	depth=6 (slower, fewer steps)
022	3.1816	11.3	discard	1200	9.1	bs=64 (too big)
023	3.1222	11.3	keep	1800	10.8	bs=32 30min (3 epochs, marginal gain)
024	3.1965	18.2	discard	1200	8.7	dim=512 (bigger but worse, needs more training)
025	3.2075	11.3	discard	3600	8.4	60min 6epochs (overfitting after epoch 3)
026	3.2636	18.2	discard	1200	6.8	dropout=0.3 wd=0.2 (too much regularization)
027	3.1713	18.2	discard	1200	9.4	lr=3e-4 bs=32 (wrong dim, still 512)
028	3.1532	11.3	discard	1200	10.0	H100 clean config dim=384 d=4 bs=32 lr=5e-4 20min
029	3.1281	11.3	keep	1200	10.6	lr=3e-4 (od=3.09 best!)
L01	3.3428	9.9	keep	1200	4.5	LoRA: DeiT-Small+Qwen2.5-0.5B r=16 (1 epoch, describe=3.02!)
L02	3.2300	9.9	keep	3600	7.7	LoRA 60min 3 epochs (17.9K steps)
L03	1.8190	283.5	keep	3600	48.0	LoRA r=32 bs=8 60min: ALL TASKS MASSIVELY IMPROVED
L04	1.8190	283.5	keep	3600	48.0	LoRA+unfrozen embeddings! OD=1.75 Seg=2.04 VQA=1.77 Cap=1.83
L05	1.7756	283.5	keep	7200	49.3	LoRA 2hr: real OD coords and seg polygons working!
L06	1.7937	283.5	keep	14400	48.8	4hr LoRA: bottle[399,315,419,400] dog polygon 12 vertices!
L07	1.7879	292.3	keep	7200	48.9	LoRA r=32 2hr: OD=1.70 VQA=1.73 + viz overlays
L08	1.6832150837779045	300+	keep	7200	51.9	LoRA r=64 lr=1e-4 2hr
L09	1.8202609074115754	310	discard	7200	48.0	LoRA r=64 lr=2e-4 bs=16 2hr
L10	1.8266	310	discard	14400	47.8	r=64 4hr (overfits, 2hr was better)
L10	1.8266190302371978	310	discard	14400	47.8	LoRA r=64 lr=1e-4 bs=8 4hr
L11	1.8493583890795708	310	discard	7200	47.2	r=64 2hr + augmentation (flip+color)
L12	1.6784927436709405	310	keep	7200	52.0	60K images (3x data) r=64 lr=1e-4 2hr
L13	1.6724630352854728	310	keep	14400	52.2	60K images 4hr (test if more data prevents overfit)
L14	1.7659533753991128	310	discard	28800	49.5	60K images 8hr overnight
L15	1.8039521658793092	506	discard	1200	48.5	SigLIP-B/16 + Qwen2.5-1.5B r=32 20min
L16	1.6958283454179763	506	discard	3600	51.5	SigLIP + Qwen2.5-1.5B 60min
L17	1.7197765868902206	506	discard	7200	50.9	SigLIP + Qwen2.5-1.5B 2hr
L18	1.7197765868902206	506	discard	14400	50.9	SigLIP + Qwen2.5-1.5B 4hr
